<?xml version="1.0" encoding="iso-8859-1" ?>
<!DOCTYPE mpui SYSTEM "mpui.dtd">

<mpui>
  <strings fonts="gb2312" lang="zh">
    <string id="version" text="Devel"/>
    <string id="media_menu" text="打开文件"/>
    <string id="play_menu" text="打开文件夹"/>
    <string id="tv_menu" text="播放音乐CD"/>
    <string id="playlist_menu" text="选择章节/曲目"/>    
    <string id="settings_menu" text="Settings"/>

    <string id="media_screen_title" text="Media Browser"/>
    <string id="media_all_files" text="All files"/>
    <string id="media_movie_files" text="Movie files"/>
    <string id="media_music_files" text="Music files"/>
    <string id="media_picture_files" text="Picture files"/>
    <string id="media_playlist_files" text="Playlists"/>

    <string id="tv_screen_title" text="TV Center"/>
    <string id="tv_analog" text="Analog TV"/>
    <string id="tv_digital" text="Digital TV"/>
    <string id="tv_analog_channel" text="Analog Channels"/>
    <string id="tv_digital_channel" text="Digital Channels"/>
    <string id="tv_video_in" text="Video In"/>

    <string id="playlist_screen_title" text="Playlist Editor"/>
    <string id="settings_screen_title" text="Settings"/>

    <string id="txt_help" file="help_en.txt"/>
    <string id="txt_info" text="System's Information"/>
  </strings>
</mpui>
