<?xml version="1.0" encoding="iso-8859-1" ?>
<!DOCTYPE mpui SYSTEM "mpui.dtd">

<mpui>
  <strings encoding="iso8859-1">
    <string id="version" text="Development Release pre0.99\nGeeXboX Team (C) 2004"/>
    <string id="watch_tv" text="Watch TV"/>
    <string id="tv" text="TV Center"/>
    <string id="play_dvd" text="Play CD/DVD"/>
    <string id="view_img" text="Pictures Viewer"/>
    <string id="img" text="Pictures Viewer"/>
    <string id="play_mov" text="Play Movies"/>
    <string id="mov" text="Movie Player"/>
    <string id="play_snd" text="Jukebox"/>
    <string id="snd" text="Audio Jukebox"/>
    <string id="settings" text="Settings"/>
    <string id="txt_help" file="help_en.txt"/>
    <string id="txt_info" text="System's Information"/>
  </strings>
</mpui>
